{
  "id": "turkey-dns-compat",
  "name": "Türkiye DNS Uyumluluk Modu (Cloudflare 1.1.1.1)",
  "description": "Modeset -5 ile birlikte DNS zehirlemesine karşı şeffaf Cloudflare DNS (1.1.1.1:53 / 2606:4700:4700::1111:53) yönlendirmesi.",
  "target_engine": "GoodbyeDPI",
  "arguments": [
    "-5",
    "--dns-addr", "1.1.1.1",
    "--dns-port", "53",
    "--dnsv6-addr", "2606:4700:4700::1111",
    "--dnsv6-port", "53"
  ]
}
